{
  "lab_name": "Modern Canna",
  "lab_address": "4705 Old Rd 37, Lakeland, FL 33813",
  "lab_license": "CMTL-0005",
  "lab_accreditation": "102020",
  "lab_director": "Jini Glaros, M.S.",
  "lab_cso": "Jini Glaros, M.S.",
  "lab_phone": "863-608-7800",
  "lab_website": "www.moderncanna.com",
  "client": "Trulieve",
  "client_address": "816 Commerce Blvd. Midway, FL 32343",
  "batch_number": "47993_0006162867",
  "sample_alias": "ALC-VapeCartCDT-.5g-BlueSpringCks-I-FL",
  "sample_matrix": "Vape",
  "lab_id": "IL18006-04",
  "sample_date": "2024-12-18T00:00:00",
  "received_date": "2024-12-18T14:26:00",
  "completed_date": "2024-12-20T15:12:00",
  "cannabinoids": [
    {
      "name": "delta 9-THC",
      "percent": 80.7,
      "mg": null
    },
    {
      "name": "CBD",
      "percent": 0.241,
      "mg": null
    },
    {
      "name": "CBN",
      "percent": 0.639,
      "mg": null
    },
    {
      "name": "THCa",
      "percent": 0.323,
      "mg": null
    },
    {
      "name": "THCV",
      "percent": 1.14,
      "mg": null
    },
    {
      "name": "CBC",
      "percent": 0.659,
      "mg": null
    },
    {
      "name": "CBG",
      "percent": 2.03,
      "mg": null
    },
    {
      "name": "d-Limonene",
      "percent": 0.632,
      "mg": null
    },
    {
      "name": "beta-Myrcene",
      "percent": 0.464,
      "mg": null
    },
    {
      "name": "Linalool",
      "percent": 0.32,
      "mg": null
    },
    {
      "name": "alpha-Humulene",
      "percent": 0.23,
      "mg": null
    },
    {
      "name": "alpha-Bisabolol",
      "percent": 0.182,
      "mg": null
    },
    {
      "name": "Fenchyl Alcohol",
      "percent": 0.114,
      "mg": null
    },
    {
      "name": "alpha-Terpineol",
      "percent": 0.0739,
      "mg": null
    },
    {
      "name": "alpha-Pinene",
      "percent": 0.0619,
      "mg": null
    },
    {
      "name": "beta-Pinene",
      "percent": 0.0383,
      "mg": null
    },
    {
      "name": "Terpinolene",
      "percent": 0.0376,
      "mg": null
    },
    {
      "name": "Camphene",
      "percent": 0.0217,
      "mg": null
    }
  ],
  "total_thc_percent": 81.0,
  "total_thc_mg": 405.0,
  "total_cbd_percent": 0.241,
  "total_cbd_mg": 1.21,
  "total_cbg_percent": 2.03,
  "total_cbg_mg": 10.2,
  "total_cbn_percent": 0.639,
  "total_cbn_mg": 3.2,
  "total_active_cannabinoids_percent": 85.7,
  "total_active_cannabinoids_mg": 429.0,
  "terpenes": [
    {
      "name": "beta-Caryophyllene",
      "percent": 0.632
    },
    {
      "name": "d-Limonene",
      "percent": 0.464
    },
    {
      "name": "beta-Myrcene",
      "percent": 0.32
    },
    {
      "name": "Linalool",
      "percent": 0.23
    },
    {
      "name": "alpha-Humulene",
      "percent": 0.182
    },
    {
      "name": "alpha-Bisabolol",
      "percent": 0.114
    },
    {
      "name": "Fenchyl Alcohol",
      "percent": 0.0739
    },
    {
      "name": "alpha-Terpineol",
      "percent": 0.0619
    },
    {
      "name": "alpha-Pinene",
      "percent": 0.0383
    },
    {
      "name": "beta-Pinene",
      "percent": 0.0376
    },
    {
      "name": "Terpinolene",
      "percent": 0.0266
    },
    {
      "name": "(+/-)-Borneol",
      "percent": 0.0217
    },
    {
      "name": "Camphene",
      "percent": 0.0113
    }
  ],
  "total_terpenes_percent": 2.21,
  "test_results": [
    {
      "test_name": "Potency",
      "status": "PASS"
    },
    {
      "test_name": "Homogeneity",
      "status": "PASS"
    },
    {
      "test_name": "Residual Solvents",
      "status": "COMPLETED"
    },
    {
      "test_name": "% Moisture",
      "status": "PASS"
    },
    {
      "test_name": "Water Activity",
      "status": "PASS"
    },
    {
      "test_name": "Foreign Matter",
      "status": "PASS"
    },
    {
      "test_name": "Pesticides",
      "status": "NOT TESTED"
    },
    {
      "test_name": "Mycotoxins",
      "status": "PASS"
    },
    {
      "test_name": "Heavy Metals",
      "status": "NOT TESTED"
    },
    {
      "test_name": "Microbials",
      "status": "PASS"
    }
  ],
  "raw_text": "Certificate of Analysis\nTrulieve\n816 Commerce Blvd. Midway, FL 32343\nSample Alias:\nALC-VapeCartCDT-.5g-BlueSpringCks-I-FL\nSample Date:\n12/18/24\nCompleted:\n12/20/24 15:12\nLab ID:\nIL18006-04\nSample Matrix:\nVape\nReceived:\n12/18/24 14:26\n47993_0006162867\nANALYSIS SUMMARY\nTERPENES\nPOTENCY DETAILS\n \n80.7% \n delta 9-THC\n0.241% \n CBD\n0.639% \n CBN\n0.323% \n THCa\n<LOQ% \n CBDa\n<LOQ% \n delta 8-THC\n<LOQ% \n CBGa\n1.14% \n THCV\n<LOQ% \n CBDV\n0.659% \n CBC\n2.03% \n CBG\nTotal Terpenes: 2.21%\nTotal CBG\n2.03% (10.2 mg)\nTotal CBN\n0.639% (3.20 mg)\nCompleted\nPotency\nPASS\nForeign Matter\nPASS\nHeavy Metals\nNot Tested\nHomogeneity\nPASS\nMicrobials\nPASS\nWater Activity\nPASS\nMycotoxins\nPASS\nPesticides\nNot Tested\n% Moisture\nPASS\nResidual Solvents\nCompleted\nTerpenes\nAnalyte\n%\n \n beta-Caryophyllene\n0.632\n d-Limonene\n0.464\n beta-Myrcene\n0.320\n Linalool\n0.230\n alpha-Humulene\n0.182\n alpha-Bisabolol\n0.114\n Fenchyl Alcohol\n0.0739\n alpha-Terpineol\n0.0619\n alpha-Pinene\n0.0383\n beta-Pinene\n0.0376\n Terpinolene\n0.0266\n (+/-)-Borneol\n0.0217\n Camphene\n0.0113\nTotal THC\n81.0% (405 mg)\nTotal CBD\n0.241% (1.21 mg)\nTotal Active Cannabinoids\n85.7% (429 mg)\nLOQ = Limit of Quantification\nND = Non-Detect \nRPD = Relative Percent Difference\n  MDL = Method Detection Limit\nPQL = Practical Quantitation Limit\nCopyright \u00a9 2024 Modern Canna, LLC. All rights reserved. \nThis report shall not be reproduced, distributed, or transmitted in any form or by any means, without written consent from Modern Canna, LLC.  The \nresults in this report relate only to the products analyzed. The results in this report are confidential. For more information regarding our reporting \nlimits, please visit: www.moderncanna.com/modern-canna-reporting-limits/\n4705 Old Rd 37\nLakeland, FL 33813\nwww.moderncanna.com\nCMTL-0005\nPage 1 of 1\n863-608-7800\nAccreditation #102020\nWyatt Bergel\n   Laboratory Director\nJini Glaros, M.S.\nChief Scientific Officer\n"
}